No.     Time           Source                Destination           Protocol Length Info
      1 0.000000000    10.0.2.96             10.0.2.96             TCP      78     50735 → 5000 [PSH, ACK] Seq=1 Ack=1 Win=342 Len=12 TSval=234794405 TSecr=234791905

Frame 1: 78 bytes on wire (624 bits), 78 bytes captured (624 bits) on interface 0
Ethernet II, Src: 00:00:00_00:00:00 (00:00:00:00:00:00), Dst: 00:00:00_00:00:00 (00:00:00:00:00:00)
Internet Protocol Version 4, Src: 10.0.2.96, Dst: 10.0.2.96
Transmission Control Protocol, Src Port: 50735, Dst Port: 5000, Seq: 1, Ack: 1, Len: 12
Data (12 bytes)

0000  00 0c 9c 40 20 dc 00 00 00 04 a5 60               ...@ ......`

No.     Time           Source                Destination           Protocol Length Info
      2 0.000658702    10.0.2.96             10.0.2.96             TCP      80     5000 → 50735 [PSH, ACK] Seq=1 Ack=13 Win=342 Len=14 TSval=234794405 TSecr=234794405

Frame 2: 80 bytes on wire (640 bits), 80 bytes captured (640 bits) on interface 0
Ethernet II, Src: 00:00:00_00:00:00 (00:00:00:00:00:00), Dst: 00:00:00_00:00:00 (00:00:00:00:00:00)
Internet Protocol Version 4, Src: 10.0.2.96, Dst: 10.0.2.96
Transmission Control Protocol, Src Port: 5000, Dst Port: 50735, Seq: 1, Ack: 13, Len: 14
Data (14 bytes)

0000  00 0e 9c 40 20 dc 00 00 00 04 a5 62 02 42         ...@ ......b.B

No.     Time           Source                Destination           Protocol Length Info
      3 0.000675932    10.0.2.96             10.0.2.96             TCP      66     50735 → 5000 [ACK] Seq=13 Ack=15 Win=342 Len=0 TSval=234794405 TSecr=234794405

Frame 3: 66 bytes on wire (528 bits), 66 bytes captured (528 bits) on interface 0
Ethernet II, Src: 00:00:00_00:00:00 (00:00:00:00:00:00), Dst: 00:00:00_00:00:00 (00:00:00:00:00:00)
Internet Protocol Version 4, Src: 10.0.2.96, Dst: 10.0.2.96
Transmission Control Protocol, Src Port: 50735, Dst Port: 5000, Seq: 13, Ack: 15, Len: 0

No.     Time           Source                Destination           Protocol Length Info
      4 0.000722026    10.0.2.96             10.0.2.96             TCP      78     50735 → 5000 [PSH, ACK] Seq=13 Ack=15 Win=342 Len=12 TSval=234794405 TSecr=234794405

Frame 4: 78 bytes on wire (624 bits), 78 bytes captured (624 bits) on interface 0
Ethernet II, Src: 00:00:00_00:00:00 (00:00:00:00:00:00), Dst: 00:00:00_00:00:00 (00:00:00:00:00:00)
Internet Protocol Version 4, Src: 10.0.2.96, Dst: 10.0.2.96
Transmission Control Protocol, Src Port: 50735, Dst Port: 5000, Seq: 13, Ack: 15, Len: 12
Data (12 bytes)

0000  00 0c 9c 40 20 dc 00 00 00 04 a5 60               ...@ ......`

No.     Time           Source                Destination           Protocol Length Info
      5 0.042330996    10.0.2.96             10.0.2.96             TCP      66     5000 → 50735 [ACK] Seq=15 Ack=25 Win=342 Len=0 TSval=234794416 TSecr=234794405

Frame 5: 66 bytes on wire (528 bits), 66 bytes captured (528 bits) on interface 0
Ethernet II, Src: 00:00:00_00:00:00 (00:00:00:00:00:00), Dst: 00:00:00_00:00:00 (00:00:00:00:00:00)
Internet Protocol Version 4, Src: 10.0.2.96, Dst: 10.0.2.96
Transmission Control Protocol, Src Port: 5000, Dst Port: 50735, Seq: 15, Ack: 25, Len: 0

No.     Time           Source                Destination           Protocol Length Info
      6 0.100927228    10.0.2.96             10.0.2.96             TCP      80     5000 → 50735 [PSH, ACK] Seq=15 Ack=25 Win=342 Len=14 TSval=234794430 TSecr=234794405

Frame 6: 80 bytes on wire (640 bits), 80 bytes captured (640 bits) on interface 0
Ethernet II, Src: 00:00:00_00:00:00 (00:00:00:00:00:00), Dst: 00:00:00_00:00:00 (00:00:00:00:00:00)
Internet Protocol Version 4, Src: 10.0.2.96, Dst: 10.0.2.96
Transmission Control Protocol, Src Port: 5000, Dst Port: 50735, Seq: 15, Ack: 25, Len: 14
Data (14 bytes)

0000  00 0e 9c 40 20 dc 00 00 00 04 a5 62 02 42         ...@ ......b.B

No.     Time           Source                Destination           Protocol Length Info
      7 0.142330073    10.0.2.96             10.0.2.96             TCP      66     50735 → 5000 [ACK] Seq=25 Ack=29 Win=342 Len=0 TSval=234794441 TSecr=234794430

Frame 7: 66 bytes on wire (528 bits), 66 bytes captured (528 bits) on interface 0
Ethernet II, Src: 00:00:00_00:00:00 (00:00:00:00:00:00), Dst: 00:00:00_00:00:00 (00:00:00:00:00:00)
Internet Protocol Version 4, Src: 10.0.2.96, Dst: 10.0.2.96
Transmission Control Protocol, Src Port: 50735, Dst Port: 5000, Seq: 25, Ack: 29, Len: 0
