No.     Time           Source                Destination           Protocol Length Info
      1 0.000000000    10.0.2.96             10.0.2.96             TCP      74     50671 → 5000 [SYN] Seq=0 Win=43690 Len=0 MSS=65495 SACK_PERM=1 TSval=234529628 TSecr=0 WS=128

Frame 1: 74 bytes on wire (592 bits), 74 bytes captured (592 bits) on interface 0
Ethernet II, Src: 00:00:00_00:00:00 (00:00:00:00:00:00), Dst: 00:00:00_00:00:00 (00:00:00:00:00:00)
Internet Protocol Version 4, Src: 10.0.2.96, Dst: 10.0.2.96
Transmission Control Protocol, Src Port: 50671, Dst Port: 5000, Seq: 0, Len: 0

No.     Time           Source                Destination           Protocol Length Info
      2 0.000015159    10.0.2.96             10.0.2.96             TCP      74     5000 → 50671 [SYN, ACK] Seq=0 Ack=1 Win=43690 Len=0 MSS=65495 SACK_PERM=1 TSval=234529628 TSecr=234529628 WS=128

Frame 2: 74 bytes on wire (592 bits), 74 bytes captured (592 bits) on interface 0
Ethernet II, Src: 00:00:00_00:00:00 (00:00:00:00:00:00), Dst: 00:00:00_00:00:00 (00:00:00:00:00:00)
Internet Protocol Version 4, Src: 10.0.2.96, Dst: 10.0.2.96
Transmission Control Protocol, Src Port: 5000, Dst Port: 50671, Seq: 0, Ack: 1, Len: 0

No.     Time           Source                Destination           Protocol Length Info
      3 0.000027144    10.0.2.96             10.0.2.96             TCP      66     50671 → 5000 [ACK] Seq=1 Ack=1 Win=43776 Len=0 TSval=234529628 TSecr=234529628

Frame 3: 66 bytes on wire (528 bits), 66 bytes captured (528 bits) on interface 0
Ethernet II, Src: 00:00:00_00:00:00 (00:00:00:00:00:00), Dst: 00:00:00_00:00:00 (00:00:00:00:00:00)
Internet Protocol Version 4, Src: 10.0.2.96, Dst: 10.0.2.96
Transmission Control Protocol, Src Port: 50671, Dst Port: 5000, Seq: 1, Ack: 1, Len: 0

No.     Time           Source                Destination           Protocol Length Info
      4 0.000063836    10.0.2.96             10.0.2.96             TCP      78     50671 → 5000 [PSH, ACK] Seq=1 Ack=1 Win=43776 Len=12 TSval=234529628 TSecr=234529628

Frame 4: 78 bytes on wire (624 bits), 78 bytes captured (624 bits) on interface 0
Ethernet II, Src: 00:00:00_00:00:00 (00:00:00:00:00:00), Dst: 00:00:00_00:00:00 (00:00:00:00:00:00)
Internet Protocol Version 4, Src: 10.0.2.96, Dst: 10.0.2.96
Transmission Control Protocol, Src Port: 50671, Dst Port: 5000, Seq: 1, Ack: 1, Len: 12
Data (12 bytes)

0000  00 0c 9c 40 21 20 00 00 00 44 01 00               ...@! ...D..

No.     Time           Source                Destination           Protocol Length Info
      5 0.000068501    10.0.2.96             10.0.2.96             TCP      66     5000 → 50671 [ACK] Seq=1 Ack=13 Win=43776 Len=0 TSval=234529628 TSecr=234529628

Frame 5: 66 bytes on wire (528 bits), 66 bytes captured (528 bits) on interface 0
Ethernet II, Src: 00:00:00_00:00:00 (00:00:00:00:00:00), Dst: 00:00:00_00:00:00 (00:00:00:00:00:00)
Internet Protocol Version 4, Src: 10.0.2.96, Dst: 10.0.2.96
Transmission Control Protocol, Src Port: 5000, Dst Port: 50671, Seq: 1, Ack: 13, Len: 0

No.     Time           Source                Destination           Protocol Length Info
      6 0.000209698    10.0.2.96             10.0.2.96             TCP      144    5000 → 50671 [PSH, ACK] Seq=1 Ack=13 Win=43776 Len=78 TSval=234529628 TSecr=234529628

Frame 6: 144 bytes on wire (1152 bits), 144 bytes captured (1152 bits) on interface 0
Ethernet II, Src: 00:00:00_00:00:00 (00:00:00:00:00:00), Dst: 00:00:00_00:00:00 (00:00:00:00:00:00)
Internet Protocol Version 4, Src: 10.0.2.96, Dst: 10.0.2.96
Transmission Control Protocol, Src Port: 5000, Dst Port: 50671, Seq: 1, Ack: 13, Len: 78
Data (78 bytes)

0000  00 4e 9c 40 21 20 00 00 00 44 08 02 45 74 68 53   .N.@! ...D..EthS
0010  69 6d 20 56 65 72 20 32 2e 30 38 20 42 75 69 6c   im Ver 2.08 Buil
0020  64 20 36 20 55 53 42 00 00 00 00 00 00 00 00 00   d 6 USB.........
0030  00 00 00 00 00 00 00 00 00 00 00 00 00 00 00 00   ................
0040  00 00 00 00 00 00 00 00 00 00 00 00 01 00         ..............

No.     Time           Source                Destination           Protocol Length Info
      7 0.000218131    10.0.2.96             10.0.2.96             TCP      66     50671 → 5000 [ACK] Seq=13 Ack=79 Win=43776 Len=0 TSval=234529628 TSecr=234529628

Frame 7: 66 bytes on wire (528 bits), 66 bytes captured (528 bits) on interface 0
Ethernet II, Src: 00:00:00_00:00:00 (00:00:00:00:00:00), Dst: 00:00:00_00:00:00 (00:00:00:00:00:00)
Internet Protocol Version 4, Src: 10.0.2.96, Dst: 10.0.2.96
Transmission Control Protocol, Src Port: 50671, Dst Port: 5000, Seq: 13, Ack: 79, Len: 0

No.     Time           Source                Destination           Protocol Length Info
      8 0.000234212    10.0.2.96             10.0.2.96             TCP      78     50671 → 5000 [PSH, ACK] Seq=13 Ack=79 Win=43776 Len=12 TSval=234529628 TSecr=234529628

Frame 8: 78 bytes on wire (624 bits), 78 bytes captured (624 bits) on interface 0
Ethernet II, Src: 00:00:00_00:00:00 (00:00:00:00:00:00), Dst: 00:00:00_00:00:00 (00:00:00:00:00:00)
Internet Protocol Version 4, Src: 10.0.2.96, Dst: 10.0.2.96
Transmission Control Protocol, Src Port: 50671, Dst Port: 5000, Seq: 13, Ack: 79, Len: 12
Data (12 bytes)

0000  00 0c 9c 40 20 dc 00 00 00 04 a5 60               ...@ ......`

No.     Time           Source                Destination           Protocol Length Info
      9 0.043932484    10.0.2.96             10.0.2.96             TCP      66     5000 → 50671 [ACK] Seq=79 Ack=25 Win=43776 Len=0 TSval=234529639 TSecr=234529628

Frame 9: 66 bytes on wire (528 bits), 66 bytes captured (528 bits) on interface 0
Ethernet II, Src: 00:00:00_00:00:00 (00:00:00:00:00:00), Dst: 00:00:00_00:00:00 (00:00:00:00:00:00)
Internet Protocol Version 4, Src: 10.0.2.96, Dst: 10.0.2.96
Transmission Control Protocol, Src Port: 5000, Dst Port: 50671, Seq: 79, Ack: 25, Len: 0

No.     Time           Source                Destination           Protocol Length Info
     10 0.100432614    10.0.2.96             10.0.2.96             TCP      80     5000 → 50671 [PSH, ACK] Seq=79 Ack=25 Win=43776 Len=14 TSval=234529653 TSecr=234529628

Frame 10: 80 bytes on wire (640 bits), 80 bytes captured (640 bits) on interface 0
Ethernet II, Src: 00:00:00_00:00:00 (00:00:00:00:00:00), Dst: 00:00:00_00:00:00 (00:00:00:00:00:00)
Internet Protocol Version 4, Src: 10.0.2.96, Dst: 10.0.2.96
Transmission Control Protocol, Src Port: 5000, Dst Port: 50671, Seq: 79, Ack: 25, Len: 14
Data (14 bytes)

0000  00 0e 9c 40 20 dc 00 00 00 04 a5 62 02 42         ...@ ......b.B

No.     Time           Source                Destination           Protocol Length Info
     11 0.100454007    10.0.2.96             10.0.2.96             TCP      81     50671 → 5000 [PSH, ACK] Seq=25 Ack=93 Win=43776 Len=15 TSval=234529653 TSecr=234529653

Frame 11: 81 bytes on wire (648 bits), 81 bytes captured (648 bits) on interface 0
Ethernet II, Src: 00:00:00_00:00:00 (00:00:00:00:00:00), Dst: 00:00:00_00:00:00 (00:00:00:00:00:00)
Internet Protocol Version 4, Src: 10.0.2.96, Dst: 10.0.2.96
Transmission Control Protocol, Src Port: 50671, Dst Port: 5000, Seq: 25, Ack: 93, Len: 15
Data (15 bytes)

0000  00 0f 9c 40 20 dc 00 00 00 04 a5 73 80 67 a0      ...@ ......s.g.

No.     Time           Source                Destination           Protocol Length Info
     12 0.100461131    10.0.2.96             10.0.2.96             TCP      66     5000 → 50671 [ACK] Seq=93 Ack=40 Win=43776 Len=0 TSval=234529653 TSecr=234529653

Frame 12: 66 bytes on wire (528 bits), 66 bytes captured (528 bits) on interface 0
Ethernet II, Src: 00:00:00_00:00:00 (00:00:00:00:00:00), Dst: 00:00:00_00:00:00 (00:00:00:00:00:00)
Internet Protocol Version 4, Src: 10.0.2.96, Dst: 10.0.2.96
Transmission Control Protocol, Src Port: 5000, Dst Port: 50671, Seq: 93, Ack: 40, Len: 0

No.     Time           Source                Destination           Protocol Length Info
     13 0.100564754    10.0.2.96             10.0.2.96             TCP      80     5000 → 50671 [PSH, ACK] Seq=93 Ack=40 Win=43776 Len=14 TSval=234529653 TSecr=234529653

Frame 13: 80 bytes on wire (640 bits), 80 bytes captured (640 bits) on interface 0
Ethernet II, Src: 00:00:00_00:00:00 (00:00:00:00:00:00), Dst: 00:00:00_00:00:00 (00:00:00:00:00:00)
Internet Protocol Version 4, Src: 10.0.2.96, Dst: 10.0.2.96
Transmission Control Protocol, Src Port: 5000, Dst Port: 50671, Seq: 93, Ack: 40, Len: 14
Data (14 bytes)

0000  00 0e 9c 40 20 dc 00 00 00 04 a5 71 b9 42         ...@ ......q.B

No.     Time           Source                Destination           Protocol Length Info
     14 0.100580695    10.0.2.96             10.0.2.96             TCP      81     50671 → 5000 [PSH, ACK] Seq=40 Ack=107 Win=43776 Len=15 TSval=234529653 TSecr=234529653

Frame 14: 81 bytes on wire (648 bits), 81 bytes captured (648 bits) on interface 0
Ethernet II, Src: 00:00:00_00:00:00 (00:00:00:00:00:00), Dst: 00:00:00_00:00:00 (00:00:00:00:00:00)
Internet Protocol Version 4, Src: 10.0.2.96, Dst: 10.0.2.96
Transmission Control Protocol, Src Port: 50671, Dst Port: 5000, Seq: 40, Ack: 107, Len: 15
Data (15 bytes)

0000  00 0f 9c 40 20 dc 00 00 00 04 a5 73 81 67 a0      ...@ ......s.g.

No.     Time           Source                Destination           Protocol Length Info
     15 0.100691494    10.0.2.96             10.0.2.96             TCP      80     5000 → 50671 [PSH, ACK] Seq=107 Ack=55 Win=43776 Len=14 TSval=234529653 TSecr=234529653

Frame 15: 80 bytes on wire (640 bits), 80 bytes captured (640 bits) on interface 0
Ethernet II, Src: 00:00:00_00:00:00 (00:00:00:00:00:00), Dst: 00:00:00_00:00:00 (00:00:00:00:00:00)
Internet Protocol Version 4, Src: 10.0.2.96, Dst: 10.0.2.96
Transmission Control Protocol, Src Port: 5000, Dst Port: 50671, Seq: 107, Ack: 55, Len: 14
Data (14 bytes)

0000  00 0e 9c 40 20 dc 00 00 00 04 a5 71 fc 42         ...@ ......q.B

No.     Time           Source                Destination           Protocol Length Info
     16 0.100708008    10.0.2.96             10.0.2.96             TCP      81     50671 → 5000 [PSH, ACK] Seq=55 Ack=121 Win=43776 Len=15 TSval=234529653 TSecr=234529653

Frame 16: 81 bytes on wire (648 bits), 81 bytes captured (648 bits) on interface 0
Ethernet II, Src: 00:00:00_00:00:00 (00:00:00:00:00:00), Dst: 00:00:00_00:00:00 (00:00:00:00:00:00)
Internet Protocol Version 4, Src: 10.0.2.96, Dst: 10.0.2.96
Transmission Control Protocol, Src Port: 50671, Dst Port: 5000, Seq: 55, Ack: 121, Len: 15
Data (15 bytes)

0000  00 0f 9c 40 20 dc 00 00 00 04 a5 73 82 67 a0      ...@ ......s.g.

No.     Time           Source                Destination           Protocol Length Info
     17 0.100817956    10.0.2.96             10.0.2.96             TCP      80     5000 → 50671 [PSH, ACK] Seq=121 Ack=70 Win=43776 Len=14 TSval=234529653 TSecr=234529653

Frame 17: 80 bytes on wire (640 bits), 80 bytes captured (640 bits) on interface 0
Ethernet II, Src: 00:00:00_00:00:00 (00:00:00:00:00:00), Dst: 00:00:00_00:00:00 (00:00:00:00:00:00)
Internet Protocol Version 4, Src: 10.0.2.96, Dst: 10.0.2.96
Transmission Control Protocol, Src Port: 5000, Dst Port: 50671, Seq: 121, Ack: 70, Len: 14
Data (14 bytes)

0000  00 0e 9c 40 20 dc 00 00 00 04 a5 71 01 42         ...@ ......q.B

No.     Time           Source                Destination           Protocol Length Info
     18 0.100833974    10.0.2.96             10.0.2.96             TCP      81     50671 → 5000 [PSH, ACK] Seq=70 Ack=135 Win=43776 Len=15 TSval=234529653 TSecr=234529653

Frame 18: 81 bytes on wire (648 bits), 81 bytes captured (648 bits) on interface 0
Ethernet II, Src: 00:00:00_00:00:00 (00:00:00:00:00:00), Dst: 00:00:00_00:00:00 (00:00:00:00:00:00)
Internet Protocol Version 4, Src: 10.0.2.96, Dst: 10.0.2.96
Transmission Control Protocol, Src Port: 50671, Dst Port: 5000, Seq: 70, Ack: 135, Len: 15
Data (15 bytes)

0000  00 0f 9c 40 20 dc 00 00 00 04 a5 73 83 67 a0      ...@ ......s.g.

No.     Time           Source                Destination           Protocol Length Info
     19 0.100943504    10.0.2.96             10.0.2.96             TCP      80     5000 → 50671 [PSH, ACK] Seq=135 Ack=85 Win=43776 Len=14 TSval=234529653 TSecr=234529653

Frame 19: 80 bytes on wire (640 bits), 80 bytes captured (640 bits) on interface 0
Ethernet II, Src: 00:00:00_00:00:00 (00:00:00:00:00:00), Dst: 00:00:00_00:00:00 (00:00:00:00:00:00)
Internet Protocol Version 4, Src: 10.0.2.96, Dst: 10.0.2.96
Transmission Control Protocol, Src Port: 5000, Dst Port: 50671, Seq: 135, Ack: 85, Len: 14
Data (14 bytes)

0000  00 0e 9c 40 20 dc 00 00 00 04 a5 71 04 42         ...@ ......q.B

No.     Time           Source                Destination           Protocol Length Info
     20 0.100959459    10.0.2.96             10.0.2.96             TCP      81     50671 → 5000 [PSH, ACK] Seq=85 Ack=149 Win=43776 Len=15 TSval=234529653 TSecr=234529653

Frame 20: 81 bytes on wire (648 bits), 81 bytes captured (648 bits) on interface 0
Ethernet II, Src: 00:00:00_00:00:00 (00:00:00:00:00:00), Dst: 00:00:00_00:00:00 (00:00:00:00:00:00)
Internet Protocol Version 4, Src: 10.0.2.96, Dst: 10.0.2.96
Transmission Control Protocol, Src Port: 50671, Dst Port: 5000, Seq: 85, Ack: 149, Len: 15
Data (15 bytes)

0000  00 0f 9c 40 20 dc 00 00 00 04 a5 73 84 67 a0      ...@ ......s.g.

No.     Time           Source                Destination           Protocol Length Info
     21 0.101068980    10.0.2.96             10.0.2.96             TCP      80     5000 → 50671 [PSH, ACK] Seq=149 Ack=100 Win=43776 Len=14 TSval=234529653 TSecr=234529653

Frame 21: 80 bytes on wire (640 bits), 80 bytes captured (640 bits) on interface 0
Ethernet II, Src: 00:00:00_00:00:00 (00:00:00:00:00:00), Dst: 00:00:00_00:00:00 (00:00:00:00:00:00)
Internet Protocol Version 4, Src: 10.0.2.96, Dst: 10.0.2.96
Transmission Control Protocol, Src Port: 5000, Dst Port: 50671, Seq: 149, Ack: 100, Len: 14
Data (14 bytes)

0000  00 0e 9c 40 20 dc 00 00 00 04 a5 71 00 42         ...@ ......q.B

No.     Time           Source                Destination           Protocol Length Info
     22 0.101084815    10.0.2.96             10.0.2.96             TCP      81     50671 → 5000 [PSH, ACK] Seq=100 Ack=163 Win=43776 Len=15 TSval=234529653 TSecr=234529653

Frame 22: 81 bytes on wire (648 bits), 81 bytes captured (648 bits) on interface 0
Ethernet II, Src: 00:00:00_00:00:00 (00:00:00:00:00:00), Dst: 00:00:00_00:00:00 (00:00:00:00:00:00)
Internet Protocol Version 4, Src: 10.0.2.96, Dst: 10.0.2.96
Transmission Control Protocol, Src Port: 50671, Dst Port: 5000, Seq: 100, Ack: 163, Len: 15
Data (15 bytes)

0000  00 0f 9c 40 20 dc 00 00 00 04 a5 73 85 67 a0      ...@ ......s.g.

No.     Time           Source                Destination           Protocol Length Info
     23 0.101194766    10.0.2.96             10.0.2.96             TCP      80     5000 → 50671 [PSH, ACK] Seq=163 Ack=115 Win=43776 Len=14 TSval=234529653 TSecr=234529653

Frame 23: 80 bytes on wire (640 bits), 80 bytes captured (640 bits) on interface 0
Ethernet II, Src: 00:00:00_00:00:00 (00:00:00:00:00:00), Dst: 00:00:00_00:00:00 (00:00:00:00:00:00)
Internet Protocol Version 4, Src: 10.0.2.96, Dst: 10.0.2.96
Transmission Control Protocol, Src Port: 5000, Dst Port: 50671, Seq: 163, Ack: 115, Len: 14
Data (14 bytes)

0000  00 0e 9c 40 20 dc 00 00 00 04 a5 71 00 42         ...@ ......q.B

No.     Time           Source                Destination           Protocol Length Info
     24 0.101210643    10.0.2.96             10.0.2.96             TCP      81     50671 → 5000 [PSH, ACK] Seq=115 Ack=177 Win=43776 Len=15 TSval=234529653 TSecr=234529653

Frame 24: 81 bytes on wire (648 bits), 81 bytes captured (648 bits) on interface 0
Ethernet II, Src: 00:00:00_00:00:00 (00:00:00:00:00:00), Dst: 00:00:00_00:00:00 (00:00:00:00:00:00)
Internet Protocol Version 4, Src: 10.0.2.96, Dst: 10.0.2.96
Transmission Control Protocol, Src Port: 50671, Dst Port: 5000, Seq: 115, Ack: 177, Len: 15
Data (15 bytes)

0000  00 0f 9c 40 20 dc 00 00 00 04 a5 73 86 67 a0      ...@ ......s.g.

No.     Time           Source                Destination           Protocol Length Info
     25 0.101320311    10.0.2.96             10.0.2.96             TCP      80     5000 → 50671 [PSH, ACK] Seq=177 Ack=130 Win=43776 Len=14 TSval=234529653 TSecr=234529653

Frame 25: 80 bytes on wire (640 bits), 80 bytes captured (640 bits) on interface 0
Ethernet II, Src: 00:00:00_00:00:00 (00:00:00:00:00:00), Dst: 00:00:00_00:00:00 (00:00:00:00:00:00)
Internet Protocol Version 4, Src: 10.0.2.96, Dst: 10.0.2.96
Transmission Control Protocol, Src Port: 5000, Dst Port: 50671, Seq: 177, Ack: 130, Len: 14
Data (14 bytes)

0000  00 0e 9c 40 20 dc 00 00 00 04 a5 71 00 42         ...@ ......q.B

No.     Time           Source                Destination           Protocol Length Info
     26 0.101336317    10.0.2.96             10.0.2.96             TCP      81     50671 → 5000 [PSH, ACK] Seq=130 Ack=191 Win=43776 Len=15 TSval=234529653 TSecr=234529653

Frame 26: 81 bytes on wire (648 bits), 81 bytes captured (648 bits) on interface 0
Ethernet II, Src: 00:00:00_00:00:00 (00:00:00:00:00:00), Dst: 00:00:00_00:00:00 (00:00:00:00:00:00)
Internet Protocol Version 4, Src: 10.0.2.96, Dst: 10.0.2.96
Transmission Control Protocol, Src Port: 50671, Dst Port: 5000, Seq: 130, Ack: 191, Len: 15
Data (15 bytes)

0000  00 0f 9c 40 20 dc 00 00 00 04 a5 73 87 67 a0      ...@ ......s.g.

No.     Time           Source                Destination           Protocol Length Info
     27 0.101458106    10.0.2.96             10.0.2.96             TCP      80     5000 → 50671 [PSH, ACK] Seq=191 Ack=145 Win=43776 Len=14 TSval=234529653 TSecr=234529653

Frame 27: 80 bytes on wire (640 bits), 80 bytes captured (640 bits) on interface 0
Ethernet II, Src: 00:00:00_00:00:00 (00:00:00:00:00:00), Dst: 00:00:00_00:00:00 (00:00:00:00:00:00)
Internet Protocol Version 4, Src: 10.0.2.96, Dst: 10.0.2.96
Transmission Control Protocol, Src Port: 5000, Dst Port: 50671, Seq: 191, Ack: 145, Len: 14
Data (14 bytes)

0000  00 0e 9c 40 20 dc 00 00 00 04 a5 71 00 42         ...@ ......q.B

No.     Time           Source                Destination           Protocol Length Info
     28 0.101473472    10.0.2.96             10.0.2.96             TCP      81     50671 → 5000 [PSH, ACK] Seq=145 Ack=205 Win=43776 Len=15 TSval=234529653 TSecr=234529653

Frame 28: 81 bytes on wire (648 bits), 81 bytes captured (648 bits) on interface 0
Ethernet II, Src: 00:00:00_00:00:00 (00:00:00:00:00:00), Dst: 00:00:00_00:00:00 (00:00:00:00:00:00)
Internet Protocol Version 4, Src: 10.0.2.96, Dst: 10.0.2.96
Transmission Control Protocol, Src Port: 50671, Dst Port: 5000, Seq: 145, Ack: 205, Len: 15
Data (15 bytes)

0000  00 0f 9c 40 20 dc 00 00 00 04 a5 73 88 67 a0      ...@ ......s.g.

No.     Time           Source                Destination           Protocol Length Info
     29 0.101584150    10.0.2.96             10.0.2.96             TCP      80     5000 → 50671 [PSH, ACK] Seq=205 Ack=160 Win=43776 Len=14 TSval=234529653 TSecr=234529653

Frame 29: 80 bytes on wire (640 bits), 80 bytes captured (640 bits) on interface 0
Ethernet II, Src: 00:00:00_00:00:00 (00:00:00:00:00:00), Dst: 00:00:00_00:00:00 (00:00:00:00:00:00)
Internet Protocol Version 4, Src: 10.0.2.96, Dst: 10.0.2.96
Transmission Control Protocol, Src Port: 5000, Dst Port: 50671, Seq: 205, Ack: 160, Len: 14
Data (14 bytes)

0000  00 0e 9c 40 20 dc 00 00 00 04 a5 71 30 42         ...@ ......q0B

No.     Time           Source                Destination           Protocol Length Info
     30 0.101599420    10.0.2.96             10.0.2.96             TCP      81     50671 → 5000 [PSH, ACK] Seq=160 Ack=219 Win=43776 Len=15 TSval=234529653 TSecr=234529653

Frame 30: 81 bytes on wire (648 bits), 81 bytes captured (648 bits) on interface 0
Ethernet II, Src: 00:00:00_00:00:00 (00:00:00:00:00:00), Dst: 00:00:00_00:00:00 (00:00:00:00:00:00)
Internet Protocol Version 4, Src: 10.0.2.96, Dst: 10.0.2.96
Transmission Control Protocol, Src Port: 50671, Dst Port: 5000, Seq: 160, Ack: 219, Len: 15
Data (15 bytes)

0000  00 0f 9c 40 20 dc 00 00 00 04 a5 73 89 67 a0      ...@ ......s.g.

No.     Time           Source                Destination           Protocol Length Info
     31 0.101709936    10.0.2.96             10.0.2.96             TCP      80     5000 → 50671 [PSH, ACK] Seq=219 Ack=175 Win=43776 Len=14 TSval=234529653 TSecr=234529653

Frame 31: 80 bytes on wire (640 bits), 80 bytes captured (640 bits) on interface 0
Ethernet II, Src: 00:00:00_00:00:00 (00:00:00:00:00:00), Dst: 00:00:00_00:00:00 (00:00:00:00:00:00)
Internet Protocol Version 4, Src: 10.0.2.96, Dst: 10.0.2.96
Transmission Control Protocol, Src Port: 5000, Dst Port: 50671, Seq: 219, Ack: 175, Len: 14
Data (14 bytes)

0000  00 0e 9c 40 20 dc 00 00 00 04 a5 71 01 42         ...@ ......q.B

No.     Time           Source                Destination           Protocol Length Info
     32 0.101725299    10.0.2.96             10.0.2.96             TCP      81     50671 → 5000 [PSH, ACK] Seq=175 Ack=233 Win=43776 Len=15 TSval=234529653 TSecr=234529653

Frame 32: 81 bytes on wire (648 bits), 81 bytes captured (648 bits) on interface 0
Ethernet II, Src: 00:00:00_00:00:00 (00:00:00:00:00:00), Dst: 00:00:00_00:00:00 (00:00:00:00:00:00)
Internet Protocol Version 4, Src: 10.0.2.96, Dst: 10.0.2.96
Transmission Control Protocol, Src Port: 50671, Dst Port: 5000, Seq: 175, Ack: 233, Len: 15
Data (15 bytes)

0000  00 0f 9c 40 20 dc 00 00 00 04 a5 73 8a 67 a0      ...@ ......s.g.

No.     Time           Source                Destination           Protocol Length Info
     33 0.101835364    10.0.2.96             10.0.2.96             TCP      80     5000 → 50671 [PSH, ACK] Seq=233 Ack=190 Win=43776 Len=14 TSval=234529653 TSecr=234529653

Frame 33: 80 bytes on wire (640 bits), 80 bytes captured (640 bits) on interface 0
Ethernet II, Src: 00:00:00_00:00:00 (00:00:00:00:00:00), Dst: 00:00:00_00:00:00 (00:00:00:00:00:00)
Internet Protocol Version 4, Src: 10.0.2.96, Dst: 10.0.2.96
Transmission Control Protocol, Src Port: 5000, Dst Port: 50671, Seq: 233, Ack: 190, Len: 14
Data (14 bytes)

0000  00 0e 9c 40 20 dc 00 00 00 04 a5 71 00 42         ...@ ......q.B

No.     Time           Source                Destination           Protocol Length Info
     34 0.101850618    10.0.2.96             10.0.2.96             TCP      81     50671 → 5000 [PSH, ACK] Seq=190 Ack=247 Win=43776 Len=15 TSval=234529653 TSecr=234529653

Frame 34: 81 bytes on wire (648 bits), 81 bytes captured (648 bits) on interface 0
Ethernet II, Src: 00:00:00_00:00:00 (00:00:00:00:00:00), Dst: 00:00:00_00:00:00 (00:00:00:00:00:00)
Internet Protocol Version 4, Src: 10.0.2.96, Dst: 10.0.2.96
Transmission Control Protocol, Src Port: 50671, Dst Port: 5000, Seq: 190, Ack: 247, Len: 15
Data (15 bytes)

0000  00 0f 9c 40 20 dc 00 00 00 04 a5 73 8b 67 a0      ...@ ......s.g.

No.     Time           Source                Destination           Protocol Length Info
     35 0.101960885    10.0.2.96             10.0.2.96             TCP      80     5000 → 50671 [PSH, ACK] Seq=247 Ack=205 Win=43776 Len=14 TSval=234529653 TSecr=234529653

Frame 35: 80 bytes on wire (640 bits), 80 bytes captured (640 bits) on interface 0
Ethernet II, Src: 00:00:00_00:00:00 (00:00:00:00:00:00), Dst: 00:00:00_00:00:00 (00:00:00:00:00:00)
Internet Protocol Version 4, Src: 10.0.2.96, Dst: 10.0.2.96
Transmission Control Protocol, Src Port: 5000, Dst Port: 50671, Seq: 247, Ack: 205, Len: 14
Data (14 bytes)

0000  00 0e 9c 40 20 dc 00 00 00 04 a5 71 00 42         ...@ ......q.B

No.     Time           Source                Destination           Protocol Length Info
     36 0.101976007    10.0.2.96             10.0.2.96             TCP      81     50671 → 5000 [PSH, ACK] Seq=205 Ack=261 Win=43776 Len=15 TSval=234529653 TSecr=234529653

Frame 36: 81 bytes on wire (648 bits), 81 bytes captured (648 bits) on interface 0
Ethernet II, Src: 00:00:00_00:00:00 (00:00:00:00:00:00), Dst: 00:00:00_00:00:00 (00:00:00:00:00:00)
Internet Protocol Version 4, Src: 10.0.2.96, Dst: 10.0.2.96
Transmission Control Protocol, Src Port: 50671, Dst Port: 5000, Seq: 205, Ack: 261, Len: 15
Data (15 bytes)

0000  00 0f 9c 40 20 dc 00 00 00 04 a5 73 8c 67 a0      ...@ ......s.g.

No.     Time           Source                Destination           Protocol Length Info
     37 0.102086126    10.0.2.96             10.0.2.96             TCP      80     5000 → 50671 [PSH, ACK] Seq=261 Ack=220 Win=43776 Len=14 TSval=234529653 TSecr=234529653

Frame 37: 80 bytes on wire (640 bits), 80 bytes captured (640 bits) on interface 0
Ethernet II, Src: 00:00:00_00:00:00 (00:00:00:00:00:00), Dst: 00:00:00_00:00:00 (00:00:00:00:00:00)
Internet Protocol Version 4, Src: 10.0.2.96, Dst: 10.0.2.96
Transmission Control Protocol, Src Port: 5000, Dst Port: 50671, Seq: 261, Ack: 220, Len: 14
Data (14 bytes)

0000  00 0e 9c 40 20 dc 00 00 00 04 a5 71 30 42         ...@ ......q0B

No.     Time           Source                Destination           Protocol Length Info
     38 0.102101396    10.0.2.96             10.0.2.96             TCP      81     50671 → 5000 [PSH, ACK] Seq=220 Ack=275 Win=43776 Len=15 TSval=234529653 TSecr=234529653

Frame 38: 81 bytes on wire (648 bits), 81 bytes captured (648 bits) on interface 0
Ethernet II, Src: 00:00:00_00:00:00 (00:00:00:00:00:00), Dst: 00:00:00_00:00:00 (00:00:00:00:00:00)
Internet Protocol Version 4, Src: 10.0.2.96, Dst: 10.0.2.96
Transmission Control Protocol, Src Port: 50671, Dst Port: 5000, Seq: 220, Ack: 275, Len: 15
Data (15 bytes)

0000  00 0f 9c 40 20 dc 00 00 00 04 a5 73 8d 67 a0      ...@ ......s.g.

No.     Time           Source                Destination           Protocol Length Info
     39 0.102211563    10.0.2.96             10.0.2.96             TCP      80     5000 → 50671 [PSH, ACK] Seq=275 Ack=235 Win=43776 Len=14 TSval=234529653 TSecr=234529653

Frame 39: 80 bytes on wire (640 bits), 80 bytes captured (640 bits) on interface 0
Ethernet II, Src: 00:00:00_00:00:00 (00:00:00:00:00:00), Dst: 00:00:00_00:00:00 (00:00:00:00:00:00)
Internet Protocol Version 4, Src: 10.0.2.96, Dst: 10.0.2.96
Transmission Control Protocol, Src Port: 5000, Dst Port: 50671, Seq: 275, Ack: 235, Len: 14
Data (14 bytes)

0000  00 0e 9c 40 20 dc 00 00 00 04 a5 71 02 42         ...@ ......q.B

No.     Time           Source                Destination           Protocol Length Info
     40 0.102226902    10.0.2.96             10.0.2.96             TCP      81     50671 → 5000 [PSH, ACK] Seq=235 Ack=289 Win=43776 Len=15 TSval=234529653 TSecr=234529653

Frame 40: 81 bytes on wire (648 bits), 81 bytes captured (648 bits) on interface 0
Ethernet II, Src: 00:00:00_00:00:00 (00:00:00:00:00:00), Dst: 00:00:00_00:00:00 (00:00:00:00:00:00)
Internet Protocol Version 4, Src: 10.0.2.96, Dst: 10.0.2.96
Transmission Control Protocol, Src Port: 50671, Dst Port: 5000, Seq: 235, Ack: 289, Len: 15
Data (15 bytes)

0000  00 0f 9c 40 20 dc 00 00 00 04 a5 73 8e 67 a0      ...@ ......s.g.

No.     Time           Source                Destination           Protocol Length Info
     41 0.102337370    10.0.2.96             10.0.2.96             TCP      80     5000 → 50671 [PSH, ACK] Seq=289 Ack=250 Win=43776 Len=14 TSval=234529653 TSecr=234529653

Frame 41: 80 bytes on wire (640 bits), 80 bytes captured (640 bits) on interface 0
Ethernet II, Src: 00:00:00_00:00:00 (00:00:00:00:00:00), Dst: 00:00:00_00:00:00 (00:00:00:00:00:00)
Internet Protocol Version 4, Src: 10.0.2.96, Dst: 10.0.2.96
Transmission Control Protocol, Src Port: 5000, Dst Port: 50671, Seq: 289, Ack: 250, Len: 14
Data (14 bytes)

0000  00 0e 9c 40 20 dc 00 00 00 04 a5 71 00 42         ...@ ......q.B

No.     Time           Source                Destination           Protocol Length Info
     42 0.102352636    10.0.2.96             10.0.2.96             TCP      81     50671 → 5000 [PSH, ACK] Seq=250 Ack=303 Win=43776 Len=15 TSval=234529653 TSecr=234529653

Frame 42: 81 bytes on wire (648 bits), 81 bytes captured (648 bits) on interface 0
Ethernet II, Src: 00:00:00_00:00:00 (00:00:00:00:00:00), Dst: 00:00:00_00:00:00 (00:00:00:00:00:00)
Internet Protocol Version 4, Src: 10.0.2.96, Dst: 10.0.2.96
Transmission Control Protocol, Src Port: 50671, Dst Port: 5000, Seq: 250, Ack: 303, Len: 15
Data (15 bytes)

0000  00 0f 9c 40 20 dc 00 00 00 04 a5 73 8f 67 a0      ...@ ......s.g.

No.     Time           Source                Destination           Protocol Length Info
     43 0.102462434    10.0.2.96             10.0.2.96             TCP      80     5000 → 50671 [PSH, ACK] Seq=303 Ack=265 Win=43776 Len=14 TSval=234529653 TSecr=234529653

Frame 43: 80 bytes on wire (640 bits), 80 bytes captured (640 bits) on interface 0
Ethernet II, Src: 00:00:00_00:00:00 (00:00:00:00:00:00), Dst: 00:00:00_00:00:00 (00:00:00:00:00:00)
Internet Protocol Version 4, Src: 10.0.2.96, Dst: 10.0.2.96
Transmission Control Protocol, Src Port: 5000, Dst Port: 50671, Seq: 303, Ack: 265, Len: 14
Data (14 bytes)

0000  00 0e 9c 40 20 dc 00 00 00 04 a5 71 00 42         ...@ ......q.B

No.     Time           Source                Destination           Protocol Length Info
     44 0.102477751    10.0.2.96             10.0.2.96             TCP      81     50671 → 5000 [PSH, ACK] Seq=265 Ack=317 Win=43776 Len=15 TSval=234529653 TSecr=234529653

Frame 44: 81 bytes on wire (648 bits), 81 bytes captured (648 bits) on interface 0
Ethernet II, Src: 00:00:00_00:00:00 (00:00:00:00:00:00), Dst: 00:00:00_00:00:00 (00:00:00:00:00:00)
Internet Protocol Version 4, Src: 10.0.2.96, Dst: 10.0.2.96
Transmission Control Protocol, Src Port: 50671, Dst Port: 5000, Seq: 265, Ack: 317, Len: 15
Data (15 bytes)

0000  00 0f 9c 40 20 dc 00 00 00 04 a5 73 90 67 a0      ...@ ......s.g.

No.     Time           Source                Destination           Protocol Length Info
     45 0.102588060    10.0.2.96             10.0.2.96             TCP      80     5000 → 50671 [PSH, ACK] Seq=317 Ack=280 Win=43776 Len=14 TSval=234529653 TSecr=234529653

Frame 45: 80 bytes on wire (640 bits), 80 bytes captured (640 bits) on interface 0
Ethernet II, Src: 00:00:00_00:00:00 (00:00:00:00:00:00), Dst: 00:00:00_00:00:00 (00:00:00:00:00:00)
Internet Protocol Version 4, Src: 10.0.2.96, Dst: 10.0.2.96
Transmission Control Protocol, Src Port: 5000, Dst Port: 50671, Seq: 317, Ack: 280, Len: 14
Data (14 bytes)

0000  00 0e 9c 40 20 dc 00 00 00 04 a5 71 00 42         ...@ ......q.B

No.     Time           Source                Destination           Protocol Length Info
     46 0.102603282    10.0.2.96             10.0.2.96             TCP      81     50671 → 5000 [PSH, ACK] Seq=280 Ack=331 Win=43776 Len=15 TSval=234529653 TSecr=234529653

Frame 46: 81 bytes on wire (648 bits), 81 bytes captured (648 bits) on interface 0
Ethernet II, Src: 00:00:00_00:00:00 (00:00:00:00:00:00), Dst: 00:00:00_00:00:00 (00:00:00:00:00:00)
Internet Protocol Version 4, Src: 10.0.2.96, Dst: 10.0.2.96
Transmission Control Protocol, Src Port: 50671, Dst Port: 5000, Seq: 280, Ack: 331, Len: 15
Data (15 bytes)

0000  00 0f 9c 40 20 dc 00 00 00 04 a5 73 91 67 a0      ...@ ......s.g.

No.     Time           Source                Destination           Protocol Length Info
     47 0.102713422    10.0.2.96             10.0.2.96             TCP      80     5000 → 50671 [PSH, ACK] Seq=331 Ack=295 Win=43776 Len=14 TSval=234529653 TSecr=234529653

Frame 47: 80 bytes on wire (640 bits), 80 bytes captured (640 bits) on interface 0
Ethernet II, Src: 00:00:00_00:00:00 (00:00:00:00:00:00), Dst: 00:00:00_00:00:00 (00:00:00:00:00:00)
Internet Protocol Version 4, Src: 10.0.2.96, Dst: 10.0.2.96
Transmission Control Protocol, Src Port: 5000, Dst Port: 50671, Seq: 331, Ack: 295, Len: 14
Data (14 bytes)

0000  00 0e 9c 40 20 dc 00 00 00 04 a5 71 00 42         ...@ ......q.B

No.     Time           Source                Destination           Protocol Length Info
     48 0.102728637    10.0.2.96             10.0.2.96             TCP      81     50671 → 5000 [PSH, ACK] Seq=295 Ack=345 Win=43776 Len=15 TSval=234529653 TSecr=234529653

Frame 48: 81 bytes on wire (648 bits), 81 bytes captured (648 bits) on interface 0
Ethernet II, Src: 00:00:00_00:00:00 (00:00:00:00:00:00), Dst: 00:00:00_00:00:00 (00:00:00:00:00:00)
Internet Protocol Version 4, Src: 10.0.2.96, Dst: 10.0.2.96
Transmission Control Protocol, Src Port: 50671, Dst Port: 5000, Seq: 295, Ack: 345, Len: 15
Data (15 bytes)

0000  00 0f 9c 40 20 dc 00 00 00 04 a5 73 92 67 a0      ...@ ......s.g.

No.     Time           Source                Destination           Protocol Length Info
     49 0.102839132    10.0.2.96             10.0.2.96             TCP      80     5000 → 50671 [PSH, ACK] Seq=345 Ack=310 Win=43776 Len=14 TSval=234529653 TSecr=234529653

Frame 49: 80 bytes on wire (640 bits), 80 bytes captured (640 bits) on interface 0
Ethernet II, Src: 00:00:00_00:00:00 (00:00:00:00:00:00), Dst: 00:00:00_00:00:00 (00:00:00:00:00:00)
Internet Protocol Version 4, Src: 10.0.2.96, Dst: 10.0.2.96
Transmission Control Protocol, Src Port: 5000, Dst Port: 50671, Seq: 345, Ack: 310, Len: 14
Data (14 bytes)

0000  00 0e 9c 40 20 dc 00 00 00 04 a5 71 00 42         ...@ ......q.B

No.     Time           Source                Destination           Protocol Length Info
     50 0.102854877    10.0.2.96             10.0.2.96             TCP      81     50671 → 5000 [PSH, ACK] Seq=310 Ack=359 Win=43776 Len=15 TSval=234529653 TSecr=234529653

Frame 50: 81 bytes on wire (648 bits), 81 bytes captured (648 bits) on interface 0
Ethernet II, Src: 00:00:00_00:00:00 (00:00:00:00:00:00), Dst: 00:00:00_00:00:00 (00:00:00:00:00:00)
Internet Protocol Version 4, Src: 10.0.2.96, Dst: 10.0.2.96
Transmission Control Protocol, Src Port: 50671, Dst Port: 5000, Seq: 310, Ack: 359, Len: 15
Data (15 bytes)

0000  00 0f 9c 40 20 dc 00 00 00 04 a5 73 93 67 a0      ...@ ......s.g.

No.     Time           Source                Destination           Protocol Length Info
     51 0.102964434    10.0.2.96             10.0.2.96             TCP      80     5000 → 50671 [PSH, ACK] Seq=359 Ack=325 Win=43776 Len=14 TSval=234529653 TSecr=234529653

Frame 51: 80 bytes on wire (640 bits), 80 bytes captured (640 bits) on interface 0
Ethernet II, Src: 00:00:00_00:00:00 (00:00:00:00:00:00), Dst: 00:00:00_00:00:00 (00:00:00:00:00:00)
Internet Protocol Version 4, Src: 10.0.2.96, Dst: 10.0.2.96
Transmission Control Protocol, Src Port: 5000, Dst Port: 50671, Seq: 359, Ack: 325, Len: 14
Data (14 bytes)

0000  00 0e 9c 40 20 dc 00 00 00 04 a5 71 00 42         ...@ ......q.B

No.     Time           Source                Destination           Protocol Length Info
     52 0.102979715    10.0.2.96             10.0.2.96             TCP      81     50671 → 5000 [PSH, ACK] Seq=325 Ack=373 Win=43776 Len=15 TSval=234529653 TSecr=234529653

Frame 52: 81 bytes on wire (648 bits), 81 bytes captured (648 bits) on interface 0
Ethernet II, Src: 00:00:00_00:00:00 (00:00:00:00:00:00), Dst: 00:00:00_00:00:00 (00:00:00:00:00:00)
Internet Protocol Version 4, Src: 10.0.2.96, Dst: 10.0.2.96
Transmission Control Protocol, Src Port: 50671, Dst Port: 5000, Seq: 325, Ack: 373, Len: 15
Data (15 bytes)

0000  00 0f 9c 40 20 dc 00 00 00 04 a5 73 94 67 a0      ...@ ......s.g.

No.     Time           Source                Destination           Protocol Length Info
     53 0.103090129    10.0.2.96             10.0.2.96             TCP      80     5000 → 50671 [PSH, ACK] Seq=373 Ack=340 Win=43776 Len=14 TSval=234529653 TSecr=234529653

Frame 53: 80 bytes on wire (640 bits), 80 bytes captured (640 bits) on interface 0
Ethernet II, Src: 00:00:00_00:00:00 (00:00:00:00:00:00), Dst: 00:00:00_00:00:00 (00:00:00:00:00:00)
Internet Protocol Version 4, Src: 10.0.2.96, Dst: 10.0.2.96
Transmission Control Protocol, Src Port: 5000, Dst Port: 50671, Seq: 373, Ack: 340, Len: 14
Data (14 bytes)

0000  00 0e 9c 40 20 dc 00 00 00 04 a5 71 01 42         ...@ ......q.B

No.     Time           Source                Destination           Protocol Length Info
     54 0.103105354    10.0.2.96             10.0.2.96             TCP      81     50671 → 5000 [PSH, ACK] Seq=340 Ack=387 Win=43776 Len=15 TSval=234529653 TSecr=234529653

Frame 54: 81 bytes on wire (648 bits), 81 bytes captured (648 bits) on interface 0
Ethernet II, Src: 00:00:00_00:00:00 (00:00:00:00:00:00), Dst: 00:00:00_00:00:00 (00:00:00:00:00:00)
Internet Protocol Version 4, Src: 10.0.2.96, Dst: 10.0.2.96
Transmission Control Protocol, Src Port: 50671, Dst Port: 5000, Seq: 340, Ack: 387, Len: 15
Data (15 bytes)

0000  00 0f 9c 40 20 dc 00 00 00 04 a5 73 95 67 a0      ...@ ......s.g.

No.     Time           Source                Destination           Protocol Length Info
     55 0.103215160    10.0.2.96             10.0.2.96             TCP      80     5000 → 50671 [PSH, ACK] Seq=387 Ack=355 Win=43776 Len=14 TSval=234529653 TSecr=234529653

Frame 55: 80 bytes on wire (640 bits), 80 bytes captured (640 bits) on interface 0
Ethernet II, Src: 00:00:00_00:00:00 (00:00:00:00:00:00), Dst: 00:00:00_00:00:00 (00:00:00:00:00:00)
Internet Protocol Version 4, Src: 10.0.2.96, Dst: 10.0.2.96
Transmission Control Protocol, Src Port: 5000, Dst Port: 50671, Seq: 387, Ack: 355, Len: 14
Data (14 bytes)

0000  00 0e 9c 40 20 dc 00 00 00 04 a5 71 01 42         ...@ ......q.B

No.     Time           Source                Destination           Protocol Length Info
     56 0.103230538    10.0.2.96             10.0.2.96             TCP      81     50671 → 5000 [PSH, ACK] Seq=355 Ack=401 Win=43776 Len=15 TSval=234529653 TSecr=234529653

Frame 56: 81 bytes on wire (648 bits), 81 bytes captured (648 bits) on interface 0
Ethernet II, Src: 00:00:00_00:00:00 (00:00:00:00:00:00), Dst: 00:00:00_00:00:00 (00:00:00:00:00:00)
Internet Protocol Version 4, Src: 10.0.2.96, Dst: 10.0.2.96
Transmission Control Protocol, Src Port: 50671, Dst Port: 5000, Seq: 355, Ack: 401, Len: 15
Data (15 bytes)

0000  00 0f 9c 40 20 dc 00 00 00 04 a5 73 96 67 a0      ...@ ......s.g.

No.     Time           Source                Destination           Protocol Length Info
     57 0.103334089    10.0.2.96             10.0.2.96             TCP      80     5000 → 50671 [PSH, ACK] Seq=401 Ack=370 Win=43776 Len=14 TSval=234529653 TSecr=234529653

Frame 57: 80 bytes on wire (640 bits), 80 bytes captured (640 bits) on interface 0
Ethernet II, Src: 00:00:00_00:00:00 (00:00:00:00:00:00), Dst: 00:00:00_00:00:00 (00:00:00:00:00:00)
Internet Protocol Version 4, Src: 10.0.2.96, Dst: 10.0.2.96
Transmission Control Protocol, Src Port: 5000, Dst Port: 50671, Seq: 401, Ack: 370, Len: 14
Data (14 bytes)

0000  00 0e 9c 40 20 dc 00 00 00 04 a5 71 45 42         ...@ ......qEB

No.     Time           Source                Destination           Protocol Length Info
     58 0.103349322    10.0.2.96             10.0.2.96             TCP      81     50671 → 5000 [PSH, ACK] Seq=370 Ack=415 Win=43776 Len=15 TSval=234529653 TSecr=234529653

Frame 58: 81 bytes on wire (648 bits), 81 bytes captured (648 bits) on interface 0
Ethernet II, Src: 00:00:00_00:00:00 (00:00:00:00:00:00), Dst: 00:00:00_00:00:00 (00:00:00:00:00:00)
Internet Protocol Version 4, Src: 10.0.2.96, Dst: 10.0.2.96
Transmission Control Protocol, Src Port: 50671, Dst Port: 5000, Seq: 370, Ack: 415, Len: 15
Data (15 bytes)

0000  00 0f 9c 40 20 dc 00 00 00 04 a5 73 97 67 a0      ...@ ......s.g.

No.     Time           Source                Destination           Protocol Length Info
     59 0.103452557    10.0.2.96             10.0.2.96             TCP      80     5000 → 50671 [PSH, ACK] Seq=415 Ack=385 Win=43776 Len=14 TSval=234529653 TSecr=234529653

Frame 59: 80 bytes on wire (640 bits), 80 bytes captured (640 bits) on interface 0
Ethernet II, Src: 00:00:00_00:00:00 (00:00:00:00:00:00), Dst: 00:00:00_00:00:00 (00:00:00:00:00:00)
Internet Protocol Version 4, Src: 10.0.2.96, Dst: 10.0.2.96
Transmission Control Protocol, Src Port: 5000, Dst Port: 50671, Seq: 415, Ack: 385, Len: 14
Data (14 bytes)

0000  00 0e 9c 40 20 dc 00 00 00 04 a5 71 74 42         ...@ ......qtB

No.     Time           Source                Destination           Protocol Length Info
     60 0.103467661    10.0.2.96             10.0.2.96             TCP      81     50671 → 5000 [PSH, ACK] Seq=385 Ack=429 Win=43776 Len=15 TSval=234529653 TSecr=234529653

Frame 60: 81 bytes on wire (648 bits), 81 bytes captured (648 bits) on interface 0
Ethernet II, Src: 00:00:00_00:00:00 (00:00:00:00:00:00), Dst: 00:00:00_00:00:00 (00:00:00:00:00:00)
Internet Protocol Version 4, Src: 10.0.2.96, Dst: 10.0.2.96
Transmission Control Protocol, Src Port: 50671, Dst Port: 5000, Seq: 385, Ack: 429, Len: 15
Data (15 bytes)

0000  00 0f 9c 40 20 dc 00 00 00 04 a5 73 98 67 a0      ...@ ......s.g.

No.     Time           Source                Destination           Protocol Length Info
     61 0.103570532    10.0.2.96             10.0.2.96             TCP      80     5000 → 50671 [PSH, ACK] Seq=429 Ack=400 Win=43776 Len=14 TSval=234529653 TSecr=234529653

Frame 61: 80 bytes on wire (640 bits), 80 bytes captured (640 bits) on interface 0
Ethernet II, Src: 00:00:00_00:00:00 (00:00:00:00:00:00), Dst: 00:00:00_00:00:00 (00:00:00:00:00:00)
Internet Protocol Version 4, Src: 10.0.2.96, Dst: 10.0.2.96
Transmission Control Protocol, Src Port: 5000, Dst Port: 50671, Seq: 429, Ack: 400, Len: 14
Data (14 bytes)

0000  00 0e 9c 40 20 dc 00 00 00 04 a5 71 68 42         ...@ ......qhB

No.     Time           Source                Destination           Protocol Length Info
     62 0.103586114    10.0.2.96             10.0.2.96             TCP      81     50671 → 5000 [PSH, ACK] Seq=400 Ack=443 Win=43776 Len=15 TSval=234529653 TSecr=234529653

Frame 62: 81 bytes on wire (648 bits), 81 bytes captured (648 bits) on interface 0
Ethernet II, Src: 00:00:00_00:00:00 (00:00:00:00:00:00), Dst: 00:00:00_00:00:00 (00:00:00:00:00:00)
Internet Protocol Version 4, Src: 10.0.2.96, Dst: 10.0.2.96
Transmission Control Protocol, Src Port: 50671, Dst Port: 5000, Seq: 400, Ack: 443, Len: 15
Data (15 bytes)

0000  00 0f 9c 40 20 dc 00 00 00 04 a5 73 99 67 a0      ...@ ......s.g.

No.     Time           Source                Destination           Protocol Length Info
     63 0.103689394    10.0.2.96             10.0.2.96             TCP      80     5000 → 50671 [PSH, ACK] Seq=443 Ack=415 Win=43776 Len=14 TSval=234529653 TSecr=234529653

Frame 63: 80 bytes on wire (640 bits), 80 bytes captured (640 bits) on interface 0
Ethernet II, Src: 00:00:00_00:00:00 (00:00:00:00:00:00), Dst: 00:00:00_00:00:00 (00:00:00:00:00:00)
Internet Protocol Version 4, Src: 10.0.2.96, Dst: 10.0.2.96
Transmission Control Protocol, Src Port: 5000, Dst Port: 50671, Seq: 443, Ack: 415, Len: 14
Data (14 bytes)

0000  00 0e 9c 40 20 dc 00 00 00 04 a5 71 53 42         ...@ ......qSB

No.     Time           Source                Destination           Protocol Length Info
     64 0.103704583    10.0.2.96             10.0.2.96             TCP      81     50671 → 5000 [PSH, ACK] Seq=415 Ack=457 Win=43776 Len=15 TSval=234529653 TSecr=234529653

Frame 64: 81 bytes on wire (648 bits), 81 bytes captured (648 bits) on interface 0
Ethernet II, Src: 00:00:00_00:00:00 (00:00:00:00:00:00), Dst: 00:00:00_00:00:00 (00:00:00:00:00:00)
Internet Protocol Version 4, Src: 10.0.2.96, Dst: 10.0.2.96
Transmission Control Protocol, Src Port: 50671, Dst Port: 5000, Seq: 415, Ack: 457, Len: 15
Data (15 bytes)

0000  00 0f 9c 40 20 dc 00 00 00 04 a5 73 9a 67 a0      ...@ ......s.g.

No.     Time           Source                Destination           Protocol Length Info
     65 0.103807655    10.0.2.96             10.0.2.96             TCP      80     5000 → 50671 [PSH, ACK] Seq=457 Ack=430 Win=43776 Len=14 TSval=234529653 TSecr=234529653

Frame 65: 80 bytes on wire (640 bits), 80 bytes captured (640 bits) on interface 0
Ethernet II, Src: 00:00:00_00:00:00 (00:00:00:00:00:00), Dst: 00:00:00_00:00:00 (00:00:00:00:00:00)
Internet Protocol Version 4, Src: 10.0.2.96, Dst: 10.0.2.96
Transmission Control Protocol, Src Port: 5000, Dst Port: 50671, Seq: 457, Ack: 430, Len: 14
Data (14 bytes)

0000  00 0e 9c 40 20 dc 00 00 00 04 a5 71 69 42         ...@ ......qiB

No.     Time           Source                Destination           Protocol Length Info
     66 0.103822856    10.0.2.96             10.0.2.96             TCP      81     50671 → 5000 [PSH, ACK] Seq=430 Ack=471 Win=43776 Len=15 TSval=234529653 TSecr=234529653

Frame 66: 81 bytes on wire (648 bits), 81 bytes captured (648 bits) on interface 0
Ethernet II, Src: 00:00:00_00:00:00 (00:00:00:00:00:00), Dst: 00:00:00_00:00:00 (00:00:00:00:00:00)
Internet Protocol Version 4, Src: 10.0.2.96, Dst: 10.0.2.96
Transmission Control Protocol, Src Port: 50671, Dst Port: 5000, Seq: 430, Ack: 471, Len: 15
Data (15 bytes)

0000  00 0f 9c 40 20 dc 00 00 00 04 a5 73 9b 67 a0      ...@ ......s.g.

No.     Time           Source                Destination           Protocol Length Info
     67 0.103940515    10.0.2.96             10.0.2.96             TCP      80     5000 → 50671 [PSH, ACK] Seq=471 Ack=445 Win=43776 Len=14 TSval=234529654 TSecr=234529653

Frame 67: 80 bytes on wire (640 bits), 80 bytes captured (640 bits) on interface 0
Ethernet II, Src: 00:00:00_00:00:00 (00:00:00:00:00:00), Dst: 00:00:00_00:00:00 (00:00:00:00:00:00)
Internet Protocol Version 4, Src: 10.0.2.96, Dst: 10.0.2.96
Transmission Control Protocol, Src Port: 5000, Dst Port: 50671, Seq: 471, Ack: 445, Len: 14
Data (14 bytes)

0000  00 0e 9c 40 20 dc 00 00 00 04 a5 71 6d 42         ...@ ......qmB

No.     Time           Source                Destination           Protocol Length Info
     68 0.103957047    10.0.2.96             10.0.2.96             TCP      81     50671 → 5000 [PSH, ACK] Seq=445 Ack=485 Win=43776 Len=15 TSval=234529654 TSecr=234529654

Frame 68: 81 bytes on wire (648 bits), 81 bytes captured (648 bits) on interface 0
Ethernet II, Src: 00:00:00_00:00:00 (00:00:00:00:00:00), Dst: 00:00:00_00:00:00 (00:00:00:00:00:00)
Internet Protocol Version 4, Src: 10.0.2.96, Dst: 10.0.2.96
Transmission Control Protocol, Src Port: 50671, Dst Port: 5000, Seq: 445, Ack: 485, Len: 15
Data (15 bytes)

0000  00 0f 9c 40 20 dc 00 00 00 04 a5 73 9c 67 a0      ...@ ......s.g.

No.     Time           Source                Destination           Protocol Length Info
     69 0.104061651    10.0.2.96             10.0.2.96             TCP      80     5000 → 50671 [PSH, ACK] Seq=485 Ack=460 Win=43776 Len=14 TSval=234529654 TSecr=234529654

Frame 69: 80 bytes on wire (640 bits), 80 bytes captured (640 bits) on interface 0
Ethernet II, Src: 00:00:00_00:00:00 (00:00:00:00:00:00), Dst: 00:00:00_00:00:00 (00:00:00:00:00:00)
Internet Protocol Version 4, Src: 10.0.2.96, Dst: 10.0.2.96
Transmission Control Protocol, Src Port: 5000, Dst Port: 50671, Seq: 485, Ack: 460, Len: 14
Data (14 bytes)

0000  00 0e 9c 40 20 dc 00 00 00 04 a5 71 30 42         ...@ ......q0B

No.     Time           Source                Destination           Protocol Length Info
     70 0.104077074    10.0.2.96             10.0.2.96             TCP      81     50671 → 5000 [PSH, ACK] Seq=460 Ack=499 Win=43776 Len=15 TSval=234529654 TSecr=234529654

Frame 70: 81 bytes on wire (648 bits), 81 bytes captured (648 bits) on interface 0
Ethernet II, Src: 00:00:00_00:00:00 (00:00:00:00:00:00), Dst: 00:00:00_00:00:00 (00:00:00:00:00:00)
Internet Protocol Version 4, Src: 10.0.2.96, Dst: 10.0.2.96
Transmission Control Protocol, Src Port: 50671, Dst Port: 5000, Seq: 460, Ack: 499, Len: 15
Data (15 bytes)

0000  00 0f 9c 40 20 dc 00 00 00 04 a5 73 9d 67 a0      ...@ ......s.g.

No.     Time           Source                Destination           Protocol Length Info
     71 0.104179987    10.0.2.96             10.0.2.96             TCP      80     5000 → 50671 [PSH, ACK] Seq=499 Ack=475 Win=43776 Len=14 TSval=234529654 TSecr=234529654

Frame 71: 80 bytes on wire (640 bits), 80 bytes captured (640 bits) on interface 0
Ethernet II, Src: 00:00:00_00:00:00 (00:00:00:00:00:00), Dst: 00:00:00_00:00:00 (00:00:00:00:00:00)
Internet Protocol Version 4, Src: 10.0.2.96, Dst: 10.0.2.96
Transmission Control Protocol, Src Port: 5000, Dst Port: 50671, Seq: 499, Ack: 475, Len: 14
Data (14 bytes)

0000  00 0e 9c 40 20 dc 00 00 00 04 a5 71 30 42         ...@ ......q0B

No.     Time           Source                Destination           Protocol Length Info
     72 0.104195091    10.0.2.96             10.0.2.96             TCP      81     50671 → 5000 [PSH, ACK] Seq=475 Ack=513 Win=43776 Len=15 TSval=234529654 TSecr=234529654

Frame 72: 81 bytes on wire (648 bits), 81 bytes captured (648 bits) on interface 0
Ethernet II, Src: 00:00:00_00:00:00 (00:00:00:00:00:00), Dst: 00:00:00_00:00:00 (00:00:00:00:00:00)
Internet Protocol Version 4, Src: 10.0.2.96, Dst: 10.0.2.96
Transmission Control Protocol, Src Port: 50671, Dst Port: 5000, Seq: 475, Ack: 513, Len: 15
Data (15 bytes)

0000  00 0f 9c 40 20 dc 00 00 00 04 a5 73 9e 67 a0      ...@ ......s.g.

No.     Time           Source                Destination           Protocol Length Info
     73 0.104297917    10.0.2.96             10.0.2.96             TCP      80     5000 → 50671 [PSH, ACK] Seq=513 Ack=490 Win=43776 Len=14 TSval=234529654 TSecr=234529654

Frame 73: 80 bytes on wire (640 bits), 80 bytes captured (640 bits) on interface 0
Ethernet II, Src: 00:00:00_00:00:00 (00:00:00:00:00:00), Dst: 00:00:00_00:00:00 (00:00:00:00:00:00)
Internet Protocol Version 4, Src: 10.0.2.96, Dst: 10.0.2.96
Transmission Control Protocol, Src Port: 5000, Dst Port: 50671, Seq: 513, Ack: 490, Len: 14
Data (14 bytes)

0000  00 0e 9c 40 20 dc 00 00 00 04 a5 71 32 42         ...@ ......q2B

No.     Time           Source                Destination           Protocol Length Info
     74 0.104313168    10.0.2.96             10.0.2.96             TCP      81     50671 → 5000 [PSH, ACK] Seq=490 Ack=527 Win=43776 Len=15 TSval=234529654 TSecr=234529654

Frame 74: 81 bytes on wire (648 bits), 81 bytes captured (648 bits) on interface 0
Ethernet II, Src: 00:00:00_00:00:00 (00:00:00:00:00:00), Dst: 00:00:00_00:00:00 (00:00:00:00:00:00)
Internet Protocol Version 4, Src: 10.0.2.96, Dst: 10.0.2.96
Transmission Control Protocol, Src Port: 50671, Dst Port: 5000, Seq: 490, Ack: 527, Len: 15
Data (15 bytes)

0000  00 0f 9c 40 20 dc 00 00 00 04 a5 73 9f 67 a0      ...@ ......s.g.

No.     Time           Source                Destination           Protocol Length Info
     75 0.104419471    10.0.2.96             10.0.2.96             TCP      80     5000 → 50671 [PSH, ACK] Seq=527 Ack=505 Win=43776 Len=14 TSval=234529654 TSecr=234529654

Frame 75: 80 bytes on wire (640 bits), 80 bytes captured (640 bits) on interface 0
Ethernet II, Src: 00:00:00_00:00:00 (00:00:00:00:00:00), Dst: 00:00:00_00:00:00 (00:00:00:00:00:00)
Internet Protocol Version 4, Src: 10.0.2.96, Dst: 10.0.2.96
Transmission Control Protocol, Src Port: 5000, Dst Port: 50671, Seq: 527, Ack: 505, Len: 14
Data (14 bytes)

0000  00 0e 9c 40 20 dc 00 00 00 04 a5 71 00 42         ...@ ......q.B

No.     Time           Source                Destination           Protocol Length Info
     76 0.104438223    10.0.2.96             10.0.2.96             TCP      80     50671 → 5000 [PSH, ACK] Seq=505 Ack=541 Win=43776 Len=14 TSval=234529654 TSecr=234529654

Frame 76: 80 bytes on wire (640 bits), 80 bytes captured (640 bits) on interface 0
Ethernet II, Src: 00:00:00_00:00:00 (00:00:00:00:00:00), Dst: 00:00:00_00:00:00 (00:00:00:00:00:00)
Internet Protocol Version 4, Src: 10.0.2.96, Dst: 10.0.2.96
Transmission Control Protocol, Src Port: 50671, Dst Port: 5000, Seq: 505, Ack: 541, Len: 14
Data (14 bytes)

0000  00 0e 9c 40 20 dc 00 00 00 04 a5 f2 08 00         ...@ .........

No.     Time           Source                Destination           Protocol Length Info
     77 0.104537903    10.0.2.96             10.0.2.96             TCP      80     5000 → 50671 [PSH, ACK] Seq=541 Ack=519 Win=43776 Len=14 TSval=234529654 TSecr=234529654

Frame 77: 80 bytes on wire (640 bits), 80 bytes captured (640 bits) on interface 0
Ethernet II, Src: 00:00:00_00:00:00 (00:00:00:00:00:00), Dst: 00:00:00_00:00:00 (00:00:00:00:00:00)
Internet Protocol Version 4, Src: 10.0.2.96, Dst: 10.0.2.96
Transmission Control Protocol, Src Port: 5000, Dst Port: 50671, Seq: 541, Ack: 519, Len: 14
Data (14 bytes)

0000  00 0e 9c 40 20 dc 00 00 00 04 a5 f3 08 01         ...@ .........

No.     Time           Source                Destination           Protocol Length Info
     78 0.104554391    10.0.2.96             10.0.2.96             TCP      81     50671 → 5000 [PSH, ACK] Seq=519 Ack=555 Win=43776 Len=15 TSval=234529654 TSecr=234529654

Frame 78: 81 bytes on wire (648 bits), 81 bytes captured (648 bits) on interface 0
Ethernet II, Src: 00:00:00_00:00:00 (00:00:00:00:00:00), Dst: 00:00:00_00:00:00 (00:00:00:00:00:00)
Internet Protocol Version 4, Src: 10.0.2.96, Dst: 10.0.2.96
Transmission Control Protocol, Src Port: 50671, Dst Port: 5000, Seq: 519, Ack: 555, Len: 15
Data (15 bytes)

0000  00 0f 9c 40 20 dc 00 00 00 04 a5 73 f0 00 a0      ...@ ......s...

No.     Time           Source                Destination           Protocol Length Info
     79 0.104656083    10.0.2.96             10.0.2.96             TCP      80     5000 → 50671 [PSH, ACK] Seq=555 Ack=534 Win=43776 Len=14 TSval=234529654 TSecr=234529654

Frame 79: 80 bytes on wire (640 bits), 80 bytes captured (640 bits) on interface 0
Ethernet II, Src: 00:00:00_00:00:00 (00:00:00:00:00:00), Dst: 00:00:00_00:00:00 (00:00:00:00:00:00)
Internet Protocol Version 4, Src: 10.0.2.96, Dst: 10.0.2.96
Transmission Control Protocol, Src Port: 5000, Dst Port: 50671, Seq: 555, Ack: 534, Len: 14
Data (14 bytes)

0000  00 0e 9c 40 20 dc 00 00 00 04 a5 71 b0 01         ...@ ......q..

No.     Time           Source                Destination           Protocol Length Info
     80 0.104671442    10.0.2.96             10.0.2.96             TCP      81     50671 → 5000 [PSH, ACK] Seq=534 Ack=569 Win=43776 Len=15 TSval=234529654 TSecr=234529654

Frame 80: 81 bytes on wire (648 bits), 81 bytes captured (648 bits) on interface 0
Ethernet II, Src: 00:00:00_00:00:00 (00:00:00:00:00:00), Dst: 00:00:00_00:00:00 (00:00:00:00:00:00)
Internet Protocol Version 4, Src: 10.0.2.96, Dst: 10.0.2.96
Transmission Control Protocol, Src Port: 50671, Dst Port: 5000, Seq: 534, Ack: 569, Len: 15
Data (15 bytes)

0000  00 0f 9c 40 20 dc 00 00 00 04 a5 73 f1 00 a0      ...@ ......s...

No.     Time           Source                Destination           Protocol Length Info
     81 0.104774040    10.0.2.96             10.0.2.96             TCP      80     5000 → 50671 [PSH, ACK] Seq=569 Ack=549 Win=43776 Len=14 TSval=234529654 TSecr=234529654

Frame 81: 80 bytes on wire (640 bits), 80 bytes captured (640 bits) on interface 0
Ethernet II, Src: 00:00:00_00:00:00 (00:00:00:00:00:00), Dst: 00:00:00_00:00:00 (00:00:00:00:00:00)
Internet Protocol Version 4, Src: 10.0.2.96, Dst: 10.0.2.96
Transmission Control Protocol, Src Port: 5000, Dst Port: 50671, Seq: 569, Ack: 549, Len: 14
Data (14 bytes)

0000  00 0e 9c 40 20 dc 00 00 00 04 a5 71 97 01         ...@ ......q..

No.     Time           Source                Destination           Protocol Length Info
     82 0.104789174    10.0.2.96             10.0.2.96             TCP      81     50671 → 5000 [PSH, ACK] Seq=549 Ack=583 Win=43776 Len=15 TSval=234529654 TSecr=234529654

Frame 82: 81 bytes on wire (648 bits), 81 bytes captured (648 bits) on interface 0
Ethernet II, Src: 00:00:00_00:00:00 (00:00:00:00:00:00), Dst: 00:00:00_00:00:00 (00:00:00:00:00:00)
Internet Protocol Version 4, Src: 10.0.2.96, Dst: 10.0.2.96
Transmission Control Protocol, Src Port: 50671, Dst Port: 5000, Seq: 549, Ack: 583, Len: 15
Data (15 bytes)

0000  00 0f 9c 40 20 dc 00 00 00 04 a5 73 f2 00 a0      ...@ ......s...

No.     Time           Source                Destination           Protocol Length Info
     83 0.104891771    10.0.2.96             10.0.2.96             TCP      80     5000 → 50671 [PSH, ACK] Seq=583 Ack=564 Win=43776 Len=14 TSval=234529654 TSecr=234529654

Frame 83: 80 bytes on wire (640 bits), 80 bytes captured (640 bits) on interface 0
Ethernet II, Src: 00:00:00_00:00:00 (00:00:00:00:00:00), Dst: 00:00:00_00:00:00 (00:00:00:00:00:00)
Internet Protocol Version 4, Src: 10.0.2.96, Dst: 10.0.2.96
Transmission Control Protocol, Src Port: 5000, Dst Port: 50671, Seq: 583, Ack: 564, Len: 14
Data (14 bytes)

0000  00 0e 9c 40 20 dc 00 00 00 04 a5 71 0d 01         ...@ ......q..

No.     Time           Source                Destination           Protocol Length Info
     84 0.104907065    10.0.2.96             10.0.2.96             TCP      81     50671 → 5000 [PSH, ACK] Seq=564 Ack=597 Win=43776 Len=15 TSval=234529654 TSecr=234529654

Frame 84: 81 bytes on wire (648 bits), 81 bytes captured (648 bits) on interface 0
Ethernet II, Src: 00:00:00_00:00:00 (00:00:00:00:00:00), Dst: 00:00:00_00:00:00 (00:00:00:00:00:00)
Internet Protocol Version 4, Src: 10.0.2.96, Dst: 10.0.2.96
Transmission Control Protocol, Src Port: 50671, Dst Port: 5000, Seq: 564, Ack: 597, Len: 15
Data (15 bytes)

0000  00 0f 9c 40 20 dc 00 00 00 04 a5 73 f3 00 a0      ...@ ......s...

No.     Time           Source                Destination           Protocol Length Info
     85 0.105010324    10.0.2.96             10.0.2.96             TCP      80     5000 → 50671 [PSH, ACK] Seq=597 Ack=579 Win=43776 Len=14 TSval=234529654 TSecr=234529654

Frame 85: 80 bytes on wire (640 bits), 80 bytes captured (640 bits) on interface 0
Ethernet II, Src: 00:00:00_00:00:00 (00:00:00:00:00:00), Dst: 00:00:00_00:00:00 (00:00:00:00:00:00)
Internet Protocol Version 4, Src: 10.0.2.96, Dst: 10.0.2.96
Transmission Control Protocol, Src Port: 5000, Dst Port: 50671, Seq: 597, Ack: 579, Len: 14
Data (14 bytes)

0000  00 0e 9c 40 20 dc 00 00 00 04 a5 71 01 01         ...@ ......q..

No.     Time           Source                Destination           Protocol Length Info
     86 0.105025656    10.0.2.96             10.0.2.96             TCP      81     50671 → 5000 [PSH, ACK] Seq=579 Ack=611 Win=43776 Len=15 TSval=234529654 TSecr=234529654

Frame 86: 81 bytes on wire (648 bits), 81 bytes captured (648 bits) on interface 0
Ethernet II, Src: 00:00:00_00:00:00 (00:00:00:00:00:00), Dst: 00:00:00_00:00:00 (00:00:00:00:00:00)
Internet Protocol Version 4, Src: 10.0.2.96, Dst: 10.0.2.96
Transmission Control Protocol, Src Port: 50671, Dst Port: 5000, Seq: 579, Ack: 611, Len: 15
Data (15 bytes)

0000  00 0f 9c 40 20 dc 00 00 00 04 a5 73 f4 00 a0      ...@ ......s...

No.     Time           Source                Destination           Protocol Length Info
     87 0.105128143    10.0.2.96             10.0.2.96             TCP      80     5000 → 50671 [PSH, ACK] Seq=611 Ack=594 Win=43776 Len=14 TSval=234529654 TSecr=234529654

Frame 87: 80 bytes on wire (640 bits), 80 bytes captured (640 bits) on interface 0
Ethernet II, Src: 00:00:00_00:00:00 (00:00:00:00:00:00), Dst: 00:00:00_00:00:00 (00:00:00:00:00:00)
Internet Protocol Version 4, Src: 10.0.2.96, Dst: 10.0.2.96
Transmission Control Protocol, Src Port: 5000, Dst Port: 50671, Seq: 611, Ack: 594, Len: 14
Data (14 bytes)

0000  00 0e 9c 40 20 dc 00 00 00 04 a5 71 00 01         ...@ ......q..

No.     Time           Source                Destination           Protocol Length Info
     88 0.105143256    10.0.2.96             10.0.2.96             TCP      81     50671 → 5000 [PSH, ACK] Seq=594 Ack=625 Win=43776 Len=15 TSval=234529654 TSecr=234529654

Frame 88: 81 bytes on wire (648 bits), 81 bytes captured (648 bits) on interface 0
Ethernet II, Src: 00:00:00_00:00:00 (00:00:00:00:00:00), Dst: 00:00:00_00:00:00 (00:00:00:00:00:00)
Internet Protocol Version 4, Src: 10.0.2.96, Dst: 10.0.2.96
Transmission Control Protocol, Src Port: 50671, Dst Port: 5000, Seq: 594, Ack: 625, Len: 15
Data (15 bytes)

0000  00 0f 9c 40 20 dc 00 00 00 04 a5 73 f5 00 a0      ...@ ......s...

No.     Time           Source                Destination           Protocol Length Info
     89 0.105245751    10.0.2.96             10.0.2.96             TCP      80     5000 → 50671 [PSH, ACK] Seq=625 Ack=609 Win=43776 Len=14 TSval=234529654 TSecr=234529654

Frame 89: 80 bytes on wire (640 bits), 80 bytes captured (640 bits) on interface 0
Ethernet II, Src: 00:00:00_00:00:00 (00:00:00:00:00:00), Dst: 00:00:00_00:00:00 (00:00:00:00:00:00)
Internet Protocol Version 4, Src: 10.0.2.96, Dst: 10.0.2.96
Transmission Control Protocol, Src Port: 5000, Dst Port: 50671, Seq: 625, Ack: 609, Len: 14
Data (14 bytes)

0000  00 0e 9c 40 20 dc 00 00 00 04 a5 71 02 01         ...@ ......q..

No.     Time           Source                Destination           Protocol Length Info
     90 0.105260777    10.0.2.96             10.0.2.96             TCP      81     50671 → 5000 [PSH, ACK] Seq=609 Ack=639 Win=43776 Len=15 TSval=234529654 TSecr=234529654

Frame 90: 81 bytes on wire (648 bits), 81 bytes captured (648 bits) on interface 0
Ethernet II, Src: 00:00:00_00:00:00 (00:00:00:00:00:00), Dst: 00:00:00_00:00:00 (00:00:00:00:00:00)
Internet Protocol Version 4, Src: 10.0.2.96, Dst: 10.0.2.96
Transmission Control Protocol, Src Port: 50671, Dst Port: 5000, Seq: 609, Ack: 639, Len: 15
Data (15 bytes)

0000  00 0f 9c 40 20 dc 00 00 00 04 a5 73 f6 00 a0      ...@ ......s...

No.     Time           Source                Destination           Protocol Length Info
     91 0.105363548    10.0.2.96             10.0.2.96             TCP      80     5000 → 50671 [PSH, ACK] Seq=639 Ack=624 Win=43776 Len=14 TSval=234529654 TSecr=234529654

Frame 91: 80 bytes on wire (640 bits), 80 bytes captured (640 bits) on interface 0
Ethernet II, Src: 00:00:00_00:00:00 (00:00:00:00:00:00), Dst: 00:00:00_00:00:00 (00:00:00:00:00:00)
Internet Protocol Version 4, Src: 10.0.2.96, Dst: 10.0.2.96
Transmission Control Protocol, Src Port: 5000, Dst Port: 50671, Seq: 639, Ack: 624, Len: 14
Data (14 bytes)

0000  00 0e 9c 40 20 dc 00 00 00 04 a5 71 00 01         ...@ ......q..

No.     Time           Source                Destination           Protocol Length Info
     92 0.105378746    10.0.2.96             10.0.2.96             TCP      81     50671 → 5000 [PSH, ACK] Seq=624 Ack=653 Win=43776 Len=15 TSval=234529654 TSecr=234529654

Frame 92: 81 bytes on wire (648 bits), 81 bytes captured (648 bits) on interface 0
Ethernet II, Src: 00:00:00_00:00:00 (00:00:00:00:00:00), Dst: 00:00:00_00:00:00 (00:00:00:00:00:00)
Internet Protocol Version 4, Src: 10.0.2.96, Dst: 10.0.2.96
Transmission Control Protocol, Src Port: 50671, Dst Port: 5000, Seq: 624, Ack: 653, Len: 15
Data (15 bytes)

0000  00 0f 9c 40 20 dc 00 00 00 04 a5 73 f7 00 a0      ...@ ......s...

No.     Time           Source                Destination           Protocol Length Info
     93 0.105481514    10.0.2.96             10.0.2.96             TCP      80     5000 → 50671 [PSH, ACK] Seq=653 Ack=639 Win=43776 Len=14 TSval=234529654 TSecr=234529654

Frame 93: 80 bytes on wire (640 bits), 80 bytes captured (640 bits) on interface 0
Ethernet II, Src: 00:00:00_00:00:00 (00:00:00:00:00:00), Dst: 00:00:00_00:00:00 (00:00:00:00:00:00)
Internet Protocol Version 4, Src: 10.0.2.96, Dst: 10.0.2.96
Transmission Control Protocol, Src Port: 5000, Dst Port: 50671, Seq: 653, Ack: 639, Len: 14
Data (14 bytes)

0000  00 0e 9c 40 20 dc 00 00 00 04 a5 71 00 01         ...@ ......q..

No.     Time           Source                Destination           Protocol Length Info
     94 0.105499605    10.0.2.96             10.0.2.96             TCP      81     50671 → 5000 [PSH, ACK] Seq=639 Ack=667 Win=43776 Len=15 TSval=234529654 TSecr=234529654

Frame 94: 81 bytes on wire (648 bits), 81 bytes captured (648 bits) on interface 0
Ethernet II, Src: 00:00:00_00:00:00 (00:00:00:00:00:00), Dst: 00:00:00_00:00:00 (00:00:00:00:00:00)
Internet Protocol Version 4, Src: 10.0.2.96, Dst: 10.0.2.96
Transmission Control Protocol, Src Port: 50671, Dst Port: 5000, Seq: 639, Ack: 667, Len: 15
Data (15 bytes)

0000  00 0f 9c 40 20 dc 00 00 00 04 a5 73 80 00 a6      ...@ ......s...

No.     Time           Source                Destination           Protocol Length Info
     95 0.105599171    10.0.2.96             10.0.2.96             TCP      80     5000 → 50671 [PSH, ACK] Seq=667 Ack=654 Win=43776 Len=14 TSval=234529654 TSecr=234529654

Frame 95: 80 bytes on wire (640 bits), 80 bytes captured (640 bits) on interface 0
Ethernet II, Src: 00:00:00_00:00:00 (00:00:00:00:00:00), Dst: 00:00:00_00:00:00 (00:00:00:00:00:00)
Internet Protocol Version 4, Src: 10.0.2.96, Dst: 10.0.2.96
Transmission Control Protocol, Src Port: 5000, Dst Port: 50671, Seq: 667, Ack: 654, Len: 14
Data (14 bytes)

0000  00 0e 9c 40 20 dc 00 00 00 04 a5 71 00 01         ...@ ......q..

No.     Time           Source                Destination           Protocol Length Info
     96 0.105614506    10.0.2.96             10.0.2.96             TCP      81     50671 → 5000 [PSH, ACK] Seq=654 Ack=681 Win=43776 Len=15 TSval=234529654 TSecr=234529654

Frame 96: 81 bytes on wire (648 bits), 81 bytes captured (648 bits) on interface 0
Ethernet II, Src: 00:00:00_00:00:00 (00:00:00:00:00:00), Dst: 00:00:00_00:00:00 (00:00:00:00:00:00)
Internet Protocol Version 4, Src: 10.0.2.96, Dst: 10.0.2.96
Transmission Control Protocol, Src Port: 50671, Dst Port: 5000, Seq: 654, Ack: 681, Len: 15
Data (15 bytes)

0000  00 0f 9c 40 20 dc 00 00 00 04 a5 73 8f 00 a6      ...@ ......s...

No.     Time           Source                Destination           Protocol Length Info
     97 0.105725167    10.0.2.96             10.0.2.96             TCP      80     5000 → 50671 [PSH, ACK] Seq=681 Ack=669 Win=43776 Len=14 TSval=234529654 TSecr=234529654

Frame 97: 80 bytes on wire (640 bits), 80 bytes captured (640 bits) on interface 0
Ethernet II, Src: 00:00:00_00:00:00 (00:00:00:00:00:00), Dst: 00:00:00_00:00:00 (00:00:00:00:00:00)
Internet Protocol Version 4, Src: 10.0.2.96, Dst: 10.0.2.96
Transmission Control Protocol, Src Port: 5000, Dst Port: 50671, Seq: 681, Ack: 669, Len: 14
Data (14 bytes)

0000  00 0e 9c 40 20 dc 00 00 00 04 a5 71 00 01         ...@ ......q..

No.     Time           Source                Destination           Protocol Length Info
     98 0.105740683    10.0.2.96             10.0.2.96             TCP      81     50671 → 5000 [PSH, ACK] Seq=669 Ack=695 Win=43776 Len=15 TSval=234529654 TSecr=234529654

Frame 98: 81 bytes on wire (648 bits), 81 bytes captured (648 bits) on interface 0
Ethernet II, Src: 00:00:00_00:00:00 (00:00:00:00:00:00), Dst: 00:00:00_00:00:00 (00:00:00:00:00:00)
Internet Protocol Version 4, Src: 10.0.2.96, Dst: 10.0.2.96
Transmission Control Protocol, Src Port: 50671, Dst Port: 5000, Seq: 669, Ack: 695, Len: 15
Data (15 bytes)

0000  00 0f 9c 40 20 dc 00 00 00 02 a5 73 10 fe a6      ...@ ......s...

No.     Time           Source                Destination           Protocol Length Info
     99 0.105824080    10.0.2.96             10.0.2.96             TCP      78     5000 → 50671 [PSH, ACK] Seq=695 Ack=684 Win=43776 Len=12 TSval=234529654 TSecr=234529654

Frame 99: 78 bytes on wire (624 bits), 78 bytes captured (624 bits) on interface 0
Ethernet II, Src: 00:00:00_00:00:00 (00:00:00:00:00:00), Dst: 00:00:00_00:00:00 (00:00:00:00:00:00)
Internet Protocol Version 4, Src: 10.0.2.96, Dst: 10.0.2.96
Transmission Control Protocol, Src Port: 5000, Dst Port: 50671, Seq: 695, Ack: 684, Len: 12
Data (12 bytes)

0000  00 0c 9c 40 20 dc 00 00 00 02 06 71               ...@ ......q

No.     Time           Source                Destination           Protocol Length Info
    100 0.105835518    10.0.2.96             10.0.2.96             TCP      81     50671 → 5000 [PSH, ACK] Seq=684 Ack=707 Win=43776 Len=15 TSval=234529654 TSecr=234529654

Frame 100: 81 bytes on wire (648 bits), 81 bytes captured (648 bits) on interface 0
Ethernet II, Src: 00:00:00_00:00:00 (00:00:00:00:00:00), Dst: 00:00:00_00:00:00 (00:00:00:00:00:00)
Internet Protocol Version 4, Src: 10.0.2.96, Dst: 10.0.2.96
Transmission Control Protocol, Src Port: 50671, Dst Port: 5000, Seq: 684, Ack: 707, Len: 15
Data (15 bytes)

0000  00 0f 9c 40 20 dc 00 00 00 04 a5 73 8e fe a6      ...@ ......s...

No.     Time           Source                Destination           Protocol Length Info
    101 0.105912743    10.0.2.96             10.0.2.96             TCP      80     5000 → 50671 [PSH, ACK] Seq=707 Ack=699 Win=43776 Len=14 TSval=234529654 TSecr=234529654

Frame 101: 80 bytes on wire (640 bits), 80 bytes captured (640 bits) on interface 0
Ethernet II, Src: 00:00:00_00:00:00 (00:00:00:00:00:00), Dst: 00:00:00_00:00:00 (00:00:00:00:00:00)
Internet Protocol Version 4, Src: 10.0.2.96, Dst: 10.0.2.96
Transmission Control Protocol, Src Port: 5000, Dst Port: 50671, Seq: 707, Ack: 699, Len: 14
Data (14 bytes)

0000  00 0e 9c 40 20 dc 00 00 00 04 a5 71 00 01         ...@ ......q..

No.     Time           Source                Destination           Protocol Length Info
    102 0.147925321    10.0.2.96             10.0.2.96             TCP      66     50671 → 5000 [ACK] Seq=699 Ack=721 Win=43776 Len=0 TSval=234529665 TSecr=234529654

Frame 102: 66 bytes on wire (528 bits), 66 bytes captured (528 bits) on interface 0
Ethernet II, Src: 00:00:00_00:00:00 (00:00:00:00:00:00), Dst: 00:00:00_00:00:00 (00:00:00:00:00:00)
Internet Protocol Version 4, Src: 10.0.2.96, Dst: 10.0.2.96
Transmission Control Protocol, Src Port: 50671, Dst Port: 5000, Seq: 699, Ack: 721, Len: 0
